{
  "schemaVersion": "1.0",
  "changeId": "okf-control-plane-v1-pr187",
  "okf": {
    "sweepStatus": "COMPLETE",
    "sourceRefs": [
      ".okf/index.md",
      ".okf/architecture.md",
      ".okf/principles.md",
      ".okf/terminology.md",
      ".okf/decision-protocol.md",
      ".okf/decisions.md",
      ".okf/floor-governance-cell.md",
      ".okf/production-helper.md",
      ".okf/security/worker-permissions.md",
      ".okf/intelligence/aer.md",
      ".okf/devourer.md",
      "Team/workflow/change-gate.md",
      "Team/contracts/team-change-ir.md",
      "Team/llm/ascalon-team-protocol.md"
    ],
    "inventory": "main .okf top-level inventory reviewed; machine compiler provides full recursive inventory in CI",
    "sweepArtifact": "generated by .github/workflows/okf-governance.yml",
    "relevantRules": [
      "OKF.PROCESS.FULL_SWEEP",
      "OKF.GOVERNANCE.TEAM_GATE",
      "OKF.AUTH.MODEL_NON_SOVEREIGN",
      "OKF.EVIDENCE.UNPROVEN_NOT_PASS",
      "OKF.SECURITY.LEAST_PRIVILEGE",
      "OKF.RELEASE.F07_VERIFIED"
    ]
  },
  "classification": "new capability",
  "forgers": [
    "Architect",
    "Builder",
    "Sentinel",
    "Evaluator",
    "Release"
  ],
  "security": {
    "required": true,
    "status": "UNPROVEN",
    "semgrep": "NOT_RUN_IN_AGENT_ENVIRONMENT",
    "strix": "UNAVAILABLE",
    "zap": "NOT_RUN",
    "note": "No security PASS is claimed by this change."
  },
  "conflicts": [
    {
      "id": "CONFLICT-PR187-GITHUB-PROTECTION",
      "originalConflict": "The control-plane manifest declares GitHub ruleset enforcement as required, but connected repository-settings capabilities did not permit configuring branch/ruleset protection during implementation.",
      "status": "ESCALATED",
      "proposedResolution": "Repository owner configures protected main/release tags and requires the OKF governance status check before treating the CI gate as a hard merge block.",
      "acceptedResolution": "",
      "decisionAuthority": "Human/Repository owner",
      "canonicalUpdates": [
        ".okf/manifest.yaml",
        ".okf/decisions.md"
      ]
    }
  ],
  "disposition": "BLOCKED",
  "evidenceRefs": [
    ".okf/manifest.yaml",
    ".okf/rules/index.json",
    ".okf/schemas/okf-rule.schema.json",
    ".okf/schemas/okf-sweep.schema.json",
    ".okf/schemas/exception-record.schema.json",
    "tools/okf/sweep.py",
    "tools/okf/lint.py",
    "tools/okf/validate_report.py",
    ".github/workflows/okf-governance.yml",
    ".github/CODEOWNERS",
    ".okf/verification/rule-to-test-matrix.md"
  ],
  "model": {
    "authority": "ADVISORY_ONLY",
    "canModifyOkf": false,
    "canPromote": false
  }
}
